{
  "updated_at": "2026-10-29",
  "headline": "Early-stage concept, documentation, and open collaboration — pre-hardware",
  "phase": "Pre-hardware / documentation",
  "next_engineering_milestone": "Acid-resistant balloon material coupon tests + small helium ground float with basic telemetry",
  "launch_posture": {
    "previous_public_claim": "",
    "current": "No committed launch date. Earliest realistic class if gates pass: ~2030–2031+",
    "note": "A long-duration Venus aerostat is multi-year after first hardware."
  },
  "budget_posture": {
    "crowdfund_target_usd": 500000,
    "label": "Ground demonstrator / prototype campaign — not full flight mission cost",
    "flight_estimate_note": "A Venus entry + float system is expected to cost far more than $500k; treat $500k as early R&D and community runway."
  },
  "built": [
    {
      "item": "Public website + interactive trajectory planner",
      "evidence": "www.nephelisindustries.com"
    },
    {
      "item": "Mission docs (CONOPS draft, requirements draft, materials protocol)",
      "evidence": "docs/ in GitHub ehreng/Nephelis"
    },
    {
      "item": "Mass budget / risks / tasks as structured data",
      "evidence": "site/content/data/*.json"
    },
    {
      "item": "AETHER OS contribution framework + daily mission loop",
      "evidence": "docs/AETHER_OS_Architecture_v1.md, aether-os/"
    }
  ],
  "not_yet": [
    "Balloon envelope hardware or acid-chamber coupon results",
    "Entry system, heatshield, or inflation hardware",
    "Flight solar, rad-tolerant avionics selection, or CubeSat hardware",
    "FAA/FCC filings submitted (path documented as drafts only)",
    "Named technical advisors listed with permission",
    "Live crowdfund payment flow (Stripe configuration pending)"
  ],
  "team": {
    "public": "Founder: Ehren Goossens (Founder Emeritus / Strategic Oversight), in U.S. Army training. Review is asynchronous. Open L1–L3 contribution via GitHub; keep working without waiting on a founder reply.",
    "authority_claims": ""
  },
  "repos": [
    {
      "name": "ehreng/Nephelis",
      "url": "https://github.com/ehreng/Nephelis",
      "role": "Single source of truth — site, docs, AETHER OS, research"
    }
  ]
}
